{"schema_version":1,"layer_id":"population_ghsl_2020_v1","data_version":"ghsl-r2023a-e2020-v1","source_epoch":2020,"crs":"ESRI:54009","bounds":[16519000.0,-600000.0,17159000.0,40000.0],"width":128,"height":128,"cell_size_m":5000,"cells":[[2474,0.0,8.0],[2601,1166.2059847936034,14.0],[2602,3539.0875036735088,25.0],[2603,0.0,8.0],[2729,4772.198613312095,20.0],[2730,2837.5079129450023,25.0],[2731,0.0,4.0],[2857,0.0,5.0],[2858,0.0,7.0],[3677,0.0,11.0],[3678,0.0,19.0],[3805,47.24047440290451,14.0],[3806,197.24970057606697,25.0],[3933,0.0,1.0],[3934,0.0,6.0]]}
